Question;Image;Image_width;Choice_1;Choice_2;Choice_3;Choice_4;Choice_5;Choice_6;Block
"¿Cuál es la función de los periféricos de entrada de un ordenador?";"";"";"Recoger información del exterior.";"Exteriorizar la información del ordenador.";"Procesar información en el ordenador.";"Almacenar información en el ordenador.";"";"";"es-hardware-perifericos-3"
"¿Cómo puede 'ver' un ordenador?";"";"";"Con una cámara.";"Con un monitor.";"Con un micrófono.";"Con un ratón.";"";"";"es-hardware-perifericos-3"
"¿Cuál es la función de los periféricos de salida en un ordenador?";"";"";"Exteriorizar la información del ordenador.";"Recoger información del exterior.";"Procesar información en el ordenador.";"Almacenar información en el ordenador.";"";"";"es-hardware-perifericos-3"
"¿Qué dispositivo se utiliza para ver la información del ordenador en forma de imágenes?";"";"";"Un monitor.";"Una impresora.";"Un altavoz.";"Un smartphone.";"";"";"es-hardware-perifericos-3"
"¿Qué es un ratón en informática?";"";"";"Un dispositivo que se utiliza para manejar con una mano un puntero en un entorno gráfico de ordenador.";"Una herramienta utilizada para imprimir documentos.";"Un dispositivo que permite escuchar música en el ordenador.";"Un tipo de teclado especial para videojuegos.";"";"";"es-hardware-perifericos-3"
"¿Cómo detecta el ratón los movimientos en el entorno gráfico?";"";"";"Detecta los movimientos en dos dimensiones sobre una superficie plana en la que se apoya.";"Detecta los movimientos mediante un escáner de huellas digitales.";"Detecta los movimientos mediante un micrófono.";"Detecta los movimientos mediante una cámara de reconocimiento facial.";"";"";"es-hardware-perifericos-3"
"¿Para qué sirve la rueda que tiene el ratón?";"";"";"Para interactuar con las pantallas del entorno gráfico.";"Para imprimir documentos.";"Para escuchar música en el ordenador.";"Para escribir documentos en el procesador de texto.";"";"";"es-hardware-perifericos-3"
"¿Qué es el puntero o flecha en la pantalla del ordenador?";"";"";"Es un puntero que muestra los movimientos del ratón.";"Es una herramienta para imprimir documentos.";"Es un tipo de teclado especial para videojuegos.";"Es un dispositivo para escuchar música en el ordenador.";"";"";"es-hardware-perifericos-3"
"¿Qué alternativas han aparecido al ratón en informática?";"";"";"La pantalla táctil.";"El escáner de huellas digitales.";"El micrófono.";"La cámara de reconocimiento facial.";"";"";"es-hardware-perifericos-3"
"¿Qué es el teclado de un ordenador?";"";"";"Es uno de los primeros dispositivos de entrada inspirado en las máquinas de escribir.";"Es un dispositivo que permite visualizar imágenes en un monitor.";"Es un dispositivo que permite escuchar sonidos a través de altavoces.";"Es un dispositivo que permite desplazarse por una página web.";"";"";"es-hardware-perifericos-3"
"¿Para qué se utiliza el teclado en un ordenador?";"";"";"Para escribir texto en el ordenador.";"Para controlar el puntero en la pantalla.";"Para escuchar sonidos a través de altavoces.";"Para interactuar con las pantallas táctiles.";"";"";"es-hardware-perifericos-3"
"¿Cuántas teclas tiene el teclado estándar de ordenador personal en Europa?";"";"";"102 teclas.";"82 teclas.";"112 teclas.";"92 teclas.";"";"";"es-hardware-perifericos-3"
"¿Qué teclas encontramos en el bloque especial del teclado?";"";"";"Teclas de dirección y otras como inicio, fin, suprimir, insertar, imprimir pantalla, etc.";"Teclas numéricas y operaciones básicas.";"Teclas de función F1 a F12.";"Teclas alfanuméricas con números del 0 al 9, letras y algunas teclas especiales.";"";"";"es-hardware-perifericos-3"
"¿Qué es el bloque numérico del teclado?";"";"";"Es un bloque a la derecha con los números y las operaciones básicas.";"Es un bloque de funciones F1 a F12.";"Es un bloque alfanumérico con números del 0 al 9, letras y algunas teclas especiales.";"Es un bloque especial con teclas de dirección y otras como inicio, fin, suprimir, insertar, imprimir pantalla, etc.";"";"";"es-hardware-perifericos-3"
"¿Qué tipo de periférico es un escáner?";"";"";"Periférico de entrada.";"Periférico de salida.";"Periférico de almacenamiento.";"Periférico de procesamiento.";"";"";"es-hardware-perifericos-3"
"¿Para qué se utiliza un escáner?";"";"";"Realizar fotografías digitales de documentos, diapositivas o transparencias.";"Imprimir documentos en papel.";"Reproducir sonido en el ordenador.";"Navegar por internet.";"";"";"es-hardware-perifericos-3"
"¿Cuál es la resolución mínima recomendada para escanear un documento?";"";"";"150 dpi.";"75 dpi.";"300 dpi.";"600 dpi.";"";"";"es-hardware-perifericos-3"
"¿Qué técnica se puede combinar con los escáneres para transformar un texto en formato imagen a un texto digitalizado?";"";"";"OCR o Reconocimiento Óptico de Caracteres.";"GPS o Sistema de Posicionamiento Global.";"HDMI o Interfaz Multimedia de Alta Definición.";"USB o Bus Universal en Serie.";"";"";"es-hardware-perifericos-3"
"¿Qué ventaja tiene utilizar OCR con un escáner?";"";"";"Transformar un texto de formato imagen a un texto digitalizado.";"Imprimir documentos de forma más rápida.";"Escanear documentos con mayor resolución.";"Reducir el tamaño de los archivos generados por el escáner.";"";"";"es-hardware-perifericos-3"
"¿Qué es una cámara web?";"";"";"Una pequeña cámara digital conectada al ordenador.";"Un dispositivo de almacenamiento de datos.";"Un periférico de salida de datos.";"Un programa informático de edición de vídeo.";"";"";"es-hardware-perifericos-3"
"¿Para qué se utiliza una cámara web?";"";"";"Capturar imágenes fijas y vídeo para transmitirlos a distancia por internet.";"Almacenar información en el ordenador.";"Realizar operaciones matemáticas complejas.";"Imprimir documentos en papel.";"";"";"es-hardware-perifericos-3"
"¿Qué ha popularizado el uso de la videoconferencia?";"";"";"Los confinamientos en 2020 debido a la pandemia de COVID.";"La falta de recursos informáticos.";"El deseo de las personas de socializar más.";"La escasez de servicios de comunicación telefónica.";"";"";"es-hardware-perifericos-3"
"¿Qué servicios se utilizan para realizar videoconferencias?";"";"";"Zoom, WhatsApp, Microsoft Teams, Google Meet, Skype, Webex, etc.";"Facebook, Instagram, Twitter, Snapchat.";"YouTube, Netflix, Amazon Prime Video.";"Spotify, Apple Music, Tidal.";"";"";"es-hardware-perifericos-3"
"¿Cuál es la ventaja de una cámara web para las reuniones virtuales?";"";"";"Permite la comunicación visual en tiempo real entre los participantes.";"Permite la transferencia de archivos grandes.";"Reduce la necesidad de conexión a Internet.";"Aumenta la privacidad de los participantes.";"";"";"es-hardware-perifericos-3"
"¿Qué es el micrófono?";"";"";"Un dispositivo que recoge el sonido del ambiente y lo traduce a señales eléctricas.";"Un dispositivo que proyecta el sonido a través de altavoces.";"Un dispositivo que proyecta la imagen a través de una pantalla.";"Un dispositivo que almacena información digital.";"";"";"es-hardware-perifericos-3"
"¿Qué es la tarjeta de sonido?";"";"";"Un dispositivo que traduce las señales eléctricas del micrófono a señales digitales.";"Un dispositivo que amplifica las señales eléctricas del micrófono.";"Un dispositivo que graba y reproduce el sonido.";"Un dispositivo que convierte las señales digitales a señales analógicas.";"";"";"es-hardware-perifericos-3"
"Los micrófonos incluidos en los dispositivos móviles suelen tener...";"";"";"Conversor analógico-digital para convertir las señales eléctricas que salen del micrófono a señales digitales.";"Mayor calidad que los micrófonos y tarjetas de sonido dedicados.";"Tecnología de micrófono dinámico.";"Menor sensibilidad que los micrófonos y tarjetas de sonido dedicados.";"";"";"es-hardware-perifericos-3"
"¿Qué ventaja tiene el uso de micrófono y tarjeta de sonido dedicados en lugar de los micrófonos integrados en otros dispositivos?";"";"";"Mayor calidad de sonido.";"Mayor facilidad de uso.";"Menor precio.";"Mayor portabilidad.";"";"";"es-hardware-perifericos-3"
"¿Qué es una tableta gráfica?";"";"";"Un periférico que permite introducir gráficos o dibujos a mano.";"Un periférico que permite introducir texto mediante reconocimiento de voz.";"Un periférico que permite introducir texto mediante un teclado.";"Un periférico que permite introducir gráficos o dibujos mediante el ratón.";"";"";"es-hardware-perifericos-3"
"¿Para qué se utiliza el estilete en la tableta gráfica?";"";"";"Para dibujar una imagen.";"Para introducir texto mediante reconocimiento de voz.";"Para apuntar y señalar los objetos que se encuentran en la pantalla del ordenador.";"Para navegar por internet.";"";"";"es-hardware-perifericos-3"
"¿Qué permite hacer la tableta gráfica con respecto a la pantalla del ordenador?";"";"";"Permite apuntar y señalar los objetos que se encuentran en la pantalla del ordenador.";"Permite controlar el brillo y contraste de la pantalla del ordenador.";"Permite introducir texto mediante reconocimiento de voz.";"Permite mover y redimensionar objetos en la pantalla del ordenador.";"";"";"es-hardware-perifericos-3"
"¿Dónde puede aparecer la imagen que se dibuja en la tableta gráfica?";"";"";"En la tableta y en el ordenador a la vez o solo en el ordenador.";"Solo en la tableta.";"Solo en el ordenador.";"En ningún sitio, ya que la tableta no permite dibujar imágenes.";"";"";"es-hardware-perifericos-3"
"¿Qué ventaja tiene utilizar una tableta gráfica en lugar del ratón para dibujar?";"";"";"La posibilidad de dibujar con mayor precisión y naturalidad.";"La posibilidad de navegar más rápidamente por internet.";"La posibilidad de controlar el brillo y contraste de la pantalla del ordenador.";"Ninguna, ya que el ratón y la tableta gráfica son equivalentes en términos de dibujo.";"";"";"es-hardware-perifericos-3"
"¿Qué es el GPS?";"";"";"Un sistema de posicionamiento global que utiliza satélites artificiales.";"Un sistema de comunicación por radio.";"Una red de cámaras de vigilancia.";"Un sistema de intercambio de archivos entre ordenadores.";"";"";"es-hardware-perifericos-3"
"¿Qué precisión tiene el GPS para localizar un receptor?";"";"";"Pocos metros.";"Pocos kilómetros.";"Pocos centímetros.";"Varias decenas de metros.";"";"";"es-hardware-perifericos-3"
"¿Qué servicios permite el GPS en los teléfonos inteligentes?";"";"";"Navegación punto a punto, localización de amigos cercanos, cálculo de recorridos para runners.";"Juegos, descargas de música, películas y libros electrónicos.";"Mensajería instantánea, videollamadas, correos electrónicos.";"Ninguna de las anteriores.";"";"";"es-hardware-perifericos-3"
"¿Qué información sensible y privada se puede deducir de la localización GPS de una persona?";"";"";"Dónde vive, qué lugares y qué personas frecuenta, a qué hora sale de casa o del trabajo, en qué vehículos se mueve, etc.";"Su número de teléfono, correo electrónico y contraseña.";"Su nombre completo, fecha de nacimiento y número de DNI.";"Ninguna de las anteriores.";"";"";"es-hardware-perifericos-3"
"¿Por qué es importante restringir el uso del GPS a los momentos y aplicaciones que consideremos imprescindibles?";"";"";"Porque la localización GPS da información sensible y privada.";"Porque el GPS consume mucha batería del dispositivo.";"Porque el GPS puede interferir en otros dispositivos electrónicos cercanos.";"Porque el GPS puede ralentizar el funcionamiento del dispositivo.";"";"";"es-hardware-perifericos-3"
"¿Qué es un acelerómetro?";"";"";"Un sensor capaz de medir aceleraciones.";"Un dispositivo que reproduce música.";"Un software para editar fotografías.";"Un juego de videoconsola.";"";"";"es-hardware-perifericos-3"
"¿En qué dispositivos está integrado el acelerómetro?";"";"";"Smartphones, pulseras de actividad física, mandos de videoconsolas, etc.";"Televisores, reproductores de música, proyectores, etc.";"Cámaras fotográficas, relojes de pulsera, planchas para el pelo, etc.";"Consolas de videojuegos, ordenadores de sobremesa, etc.";"";"";"es-hardware-perifericos-3"
"¿Para qué se utilizan los acelerómetros en los juegos de baile?";"";"";"Para saber dónde está nuestra mano y cómo la movemos.";"Para medir la temperatura corporal.";"Para contar el número de pasos que damos.";"Para saber cuántas calorías quemamos.";"";"";"es-hardware-perifericos-3"
"¿Qué permite conocer el acelerómetro en aplicaciones médicas?";"";"";"La predicción de la aparición de Alzheimer.";"La medición de la presión arterial.";"La detección de enfermedades cardíacas.";"La evaluación de la salud dental.";"";"";"es-hardware-perifericos-3"
"¿Qué otra aplicación tiene el acelerómetro aparte de los juegos y la fotografía?";"";"";"Conocer dónde se encuentra el suelo y girar las fotografías.";"Identificar la ubicación de una persona en un edificio.";"Detectar el clima y las condiciones atmosféricas.";"Controlar la apertura y cierre de puertas automáticas.";"";"";"es-hardware-perifericos-3"
"¿Qué función tiene el giroscopio?";"";"";"Conocer la orientación en el espacio de un objeto.";"Medir aceleraciones.";"Detectar el movimiento al andar o correr.";"Conocer la temperatura de la batería del smartphone.";"";"";"es-hardware-perifericos-3"
"¿Qué tipo de dispositivo incluye un giroscopio?";"";"";"Smartphones.";"Coches.";"Consolas de videojuegos.";"Neveras.";"";"";"es-hardware-perifericos-3"
"¿Qué función tiene el magnetómetro?";"";"";"Situar el norte como lo hace una brújula.";"Medir aceleraciones.";"Detectar el movimiento al andar o correr.";"Conocer la temperatura de la batería del smartphone.";"";"";"es-hardware-perifericos-3"
"¿Por qué podemos conocer el uso que estamos dando al smartphone con el termómetro de la batería?";"";"";"Porque un mayor uso se traduce en una mayor temperatura de la batería.";"Porque un mayor uso se traduce en una menor temperatura de la batería.";"Porque el termómetro de la batería mide la velocidad del procesador.";"Porque el termómetro de la batería mide la cantidad de memoria RAM disponible.";"";"";"es-hardware-perifericos-3"
"¿Qué otra información se puede obtener con el termómetro de la batería?";"";"";"Si se está cargando el teléfono o la temperatura ambiente.";"Si se está cargando el teléfono o el nivel de batería.";"La orientación en el espacio.";"La velocidad del procesador.";"";"";"es-hardware-perifericos-3"