Question;Image;Image_width;Choice_1;Choice_2;Choice_3;Choice_4;Choice_5;Choice_6;Block
"¿Cómo se llaman también las imágenes de mapa de bits?";"";"";"Imágenes Raster.";"Imágenes vectoriales.";"Imágenes escalables.";"Imágenes TrueType.";"";"";"es-software-formatos-imagen-3"
"¿De qué están formadas las imágenes de mapa de bits?";"";"";"Píxeles.";"Líneas y curvas.";"Objetos vectoriales.";"Texto.";"";"";"es-software-formatos-imagen-3"
"¿Qué sucede cuando se amplía una imagen de mapa de bits?";"";"";"La calidad de la imagen empeora.";"Las líneas y curvas mantienen su calidad.";"Los píxeles se vuelven invisibles.";"Se forman objetos vectoriales.";"";"";"es-software-formatos-imagen-3"
"¿Cómo se denominan las instrucciones que forman las imágenes vectoriales?";"";"";"Objetos vectoriales.";"Mapa de bits.";"Líneas y curvas.";"Objetos Raster.";"";"";"es-software-formatos-imagen-3"
"¿Cuál es un ejemplo de imagen de mapa de bits?";"";"";"Fotografía digital.";"Letras TrueType.";"Imagen vectorial.";"Documento PDF.";"";"";"es-software-formatos-imagen-3"
"¿Qué tipo de imagen se puede ampliar sin perder calidad?";"";"";"Las imágenes vectoriales.";"Las imágenes Raster.";"Las fotografías digitales.";"Las imágenes de mapa de bits.";"";"";"es-software-formatos-imagen-3"
"Un ejemplo de imagen vectorial se puede encontrar en las letras ...";"";"";"TrueType.";"Raster.";"Escalables.";"Píxeles.";"";"";"es-software-formatos-imagen-3"
"Una de las instrucciones de las imágenes vectoriales son ...";"";"";"Las curvas Bézier.";"Los píxeles.";"Los mapas Raster.";"Las imágenes fotográficas.";"";"";"es-software-formatos-imagen-3"
"¿Qué sucede cuando se amplía una imagen vectorial?";"";"";"Las líneas y curvas mantienen su calidad.";"La calidad de la imagen empeora con la ampliación.";"Los píxeles se vuelven visibles.";"Se forman objetos Raster.";"";"";"es-software-formatos-imagen-3"
"¿Qué es el esquema de color aditivo?";"";"";"Genera colores añadiendo fuentes de luz.";"Genera colores añadiendo tintas sobre papel.";"Utiliza solo colores primarios.";"Se aplica en impresoras.";"";"";"es-software-formatos-imagen-3"
"¿Cuáles son los colores primarios en el esquema RGB?";"";"";"Rojo, verde y azul";"Amarillo, magenta y cian";"Rojo, amarillo y azul";"Blanco, negro y gris";"";"";"es-software-formatos-imagen-3"
"¿Por qué se llama "aditivo" al esquema RGB?";"";"";"Porque se generan colores sumando fuentes de luz.";"Porque se generan colores sumando tintas de colores.";"Porque utiliza solo colores primarios.";"Porque se aplica en impresoras de inyección de tinta.";"";"";"es-software-formatos-imagen-3"
"¿Dónde se utiliza el esquema de color aditivo?";"";"";"En monitores, televisores y pantallas de teléfono.";"En impresoras e imprentas, en publicaciones a color.";"En cuadernos, libros y revistas.";"En las pinturas y lápices de colores.";"";"";"es-software-formatos-imagen-3"
"¿Qué esquema se utiliza comúnmente en monitores y televisores?";"";"";"Esquema de color aditivo RGB.";"Esquema de color sustractivo CMYK.";"Esquema de color blanco y negro.";"Esquema de colores primarios.";"";"";"es-software-formatos-imagen-3"
"¿Cómo se forma el color blanco en el esquema RGB?";"";"";"Sumando los tres colores primarios.";"Restando los tres colores primarios.";"Mezclando los colores primarios con negro.";"No es posible formar blanco en este esquema.";"";"";"es-software-formatos-imagen-3"
"¿Cómo se forma el color amarillo en el esquema RGB?";"";"";"Rojo + Verde.";"Rojo + Azul.";"Verde + Azul.";"Magenta + Cian.";"";"";"es-software-formatos-imagen-3"
"¿Cómo se forma el color magenta en el esquema RGB?";"";"";"Rojo + Azul.";"Rojo + Verde.";"Verde + Azul.";"Amarillo + Cian.";"";"";"es-software-formatos-imagen-3"
"¿Cómo se forma el color cian en el esquema RGB?";"";"";"Verde + Azul.";"Rojo + Azul.";"Rojo + Verde.";"Amarillo + Magenta.";"";"";"es-software-formatos-imagen-3"
"¿Cuáles son los colores secundarios en el esquema RGB?";"";"";"Amarillo, magenta y cian.";"Rojo, verde y azul.";"Blanco y negro.";"Rojo, amarillo y azul.";"";"";"es-software-formatos-imagen-3"
"¿Qué produce la ausencia de color en el esquema RGB?";"";"";"El color negro.";"El color blanco.";"El color gris.";"El color Amarillo.";"";"";"es-software-formatos-imagen-3"
"¿Por qué se denomina "sustractivo" al esquema CMYK?";"";"";"Porque genera colores sustrayendo colores a la luz blanca.";"Porque sustrae la luz blanca para formar colores.";"Porque utiliza solo colores secundarios.";"Porque se utiliza en monitores y televisores.";"";"";"es-software-formatos-imagen-3"
"¿Cuáles son los colores primarios en el esquema CMYK?";"";"";"Cian, magenta, amarillo y negro";"Rojo, verde y azul";"Amarillo, magenta y cian";"Blanco, negro y gris";"";"";"es-software-formatos-imagen-3"
"¿En qué se basa el esquema CMYK para generar colores?";"";"";"Reflejar la luz blanca y sustraer algún color con tintas.";"Sumar fuentes de luz.";"Utilizar solo colores secundarios.";"Absorber todos los colores.";"";"";"es-software-formatos-imagen-3"
"¿Dónde se utiliza comúnmente el esquema de color sustractivo CMYK?";"";"";"En impresoras e imprentas.";"En monitores, televisores.";"Solo lo utilizan los profesionales de la impresión.";"Se utiliza en las pantallas de los teléfonos.";"";"";"es-software-formatos-imagen-3"
"¿Por qué se utiliza una tinta específica para conseguir el color negro en el esquema CMYK?";"";"";"Porque es más sencillo y se ve más oscuro.";"Porque es más barato.";"Para ahorrar tinta.";"Para resaltar el color blanco.";"";"";"es-software-formatos-imagen-3"
"¿Qué absorbe la tinta amarilla en el esquema CMYK?";"";"";"Azul.";"Rojo.";"Verde.";"Todos los colores primarios.";"";"";"es-software-formatos-imagen-3"
"¿Qué absorbe la tinta magenta en el esquema CMYK?";"";"";"Verde.";"Azul.";"Rojo.";"Negro.";"";"";"es-software-formatos-imagen-3"
"¿Qué absorbe la tinta cian en el esquema CMYK?";"";"";"Rojo.";"Verde.";"Azul.";"Blanco.";"";"";"es-software-formatos-imagen-3"
"¿En qué se basa la formación de colores secundarios en el esquema CMYK?";"";"";"Mezclando tintas y absorbiendo más de un color.";"Sumando colores primarios.";"Reflejando la luz blanca.";"No se forman colores secundarios en este esquema.";"";"";"es-software-formatos-imagen-3"
"¿Cómo se forma el color negro en el esquema CMYK?";"";"";"Sumando los tres colores primarios o con la tinta K (negra).";"Restando los tres colores primarios cian, magenta y amarillo.";"Sin mezclar ninguna tinta.";"No es posible formar negro en este esquema.";"";"";"es-software-formatos-imagen-3"
"¿Cómo se forma el color verde en el esquema CMYK?";"";"";"Cian + Amarillo.";"Magenta + Amarillo.";"Cian + Magenta.";"Rojo + Azul.";"";"";"es-software-formatos-imagen-3"
"¿Cómo se forma el color rojo en el esquema CMYK?";"";"";"Magenta + Amarillo.";"Cian + Amarillo.";"Cian + Magenta.";"Verde + Azul.";"";"";"es-software-formatos-imagen-3"
"¿Cómo se forma el color azul en el esquema CMYK?";"";"";"Cian + Magenta.";"Magenta + Amarillo.";"Cian + Amarillo.";"Rojo + Verde.";"";"";"es-software-formatos-imagen-3"
"¿Cuáles son los colores secundarios en el esquema CMYK?";"";"";"Rojo, verde y azul.";"Amarillo, magenta y cian.";"Blanco y negro.";"Rojo, amarillo y verde.";"";"";"es-software-formatos-imagen-3"
"¿Qué produce la ausencia de color en el esquema CMYK?";"";"";"El color blanco.";"El color negro.";"El color gris.";"El color Amarillo.";"";"";"es-software-formatos-imagen-3"